{
  "keyId": "dev-key",
  "algorithm": "HS256",
  "payloadJson": "{\"tenant\":\"tenant-a\",\"issuedAt\":\"2026-08-10T12:00:00Z\",\"expiresAt\":\"2026-08-13T12:00:00Z\",\"graceUntil\":\"2026-08-17T12:00:00Z\",\"entitlements\":[{\"capability\":\"atlas.catalogue.read\",\"source\":\"bundle\"},{\"capability\":\"atlas.export.portable-bundle\",\"source\":\"bundle\"}]}",
  "signature": "c2lnbmF0dXJl"
}
